{
  "$schema": "https://metadata-resources.data.bas.ac.uk/bas-metadata-generator-configuration-schemas/v2/iec-pas-61174-1-v1.json",
  "route_author": "Constance Watson",
  "route_name": "complete-test-route",
  "route_status": "complete",
  "waypoints": [
    {
      "id": 1001,
      "revision": 0,
      "position": {
        "lat": 5.5,
        "lon": 50.55
      },
      "leg": {
        "geometry_type": "Orthodrome"
      }
    },
    {
      "id": 1002,
      "revision": 0,
      "position": {
        "lat": 5.5,
        "lon": 50.55
      },
      "leg": {
        "geometry_type": "Orthodrome"
      }
    },
    {
      "id": 1003,
      "revision": 0,
      "position": {
        "lat": 5.5,
        "lon": 50.55
      },
      "leg": {
        "geometry_type": "Orthodrome"
      }
    }
  ]
}
